id,model,age,sex,chief_complaints,symptoms_duration,symptoms_description,negative_history,past_medical_history,current_medications,family_history,social_history,duodenoscope_type,grade_of_ercp,pd_cannulation,cannulation_success,lactated_ringers,rectal_indomethacin,successful_completion,failed_ercp,scout_film_status,scout_film_optional_findings,scout_film_free_text,scope_advance_difficulty,upper_gi_examination_extent,upper_gi_findings,major_papilla_status,major_papilla_abnormal_morphology,prior_biliary_sphincterotomy_evidence,prior_biliary_sphincterotomy_orifice_patency,papilla_stent_present,periampullary_diverticulum_present,papilla_diverticulum_relationship,major_papilla_free_text,minor_papilla_status,minor_papilla_morphology,minor_papilla_prior_sphincterotomy_evidence,minor_papilla_orifice_patency,minor_papilla_free_text,ampulla_overall_appearance,ampulla_pus_present,ampulla_active_bleeding,ampulla_free_text,ampullectomy_performed,snare_size_mm,resection_style,energy_settings,specimen_retrieval_method,resection_base_assessment,ampullectomy_hemostasis_method,sphincterotome_type,guidewire_type,bile_duct_cannulation_successful,bile_duct_cannulation_difficulty,advanced_cannulation_techniques,rendezvous_attempted,rendezvous_result,pancreatic_duct_cannulation_attempted,pancreatic_duct_cannulation_success,pancreatic_duct_cannulation_technique,biliary_rendezvous_route,contrast_injection_performed,cbd_diameter_mm,ihd_status,stone_description,stricture_description,non_stone_filling_defects,bile_leak_location,prior_stent_status,cholangiogram_free_text,pancreatogram_obtained,pancreatogram_overall,main_pd_diameter_head_mm,main_pd_diameter_body_mm,main_pd_diameter_tail_mm,side_branch_status,pd_stricture_location,pd_pseudocyst_communication,sphincterotomy_type,sphincterotome_used,incision_direction,sphincterotomy_extent,sphincterotomy_goal_achieved,biliary_stent_placed,plastic_stent_details,metal_stent_details,pancreatic_stent_placed,pancreatic_stent_purpose,pancreatic_stent_details,stent_optimal_description,bile_and_contrast_drainage,final_fluoroscopic_image_obtained,estimated_blood_loss,specimens_removed,complications,impressions
bdstricture03,openai,19,male,"follow up for a known bile duct stricture, history of hilar biliary stricture and chronic thalassification pancreatitis",unknown,"Initial concern for malignancy, but prior biopsies and imaging showed no evidence of progression, suggesting a benign etiology.",no evidence of progression of malignancy,history of hilar biliary stricture and chronic thalassification pancreatitis,unknown,unknown,unknown,Olympus TJF Q180V,-1,not attempted,True,False,False,True,False,normal,biliary stent in situ,none,without_difficulty,without detailed examination,not described,normal,none,True,patent,True,False,not_applicable,none,not_visualized,unknown,False,unknown,none,normal,False,False,none,False,-1,none,not specified,snare,none,none,unknown,0.035-inch guide wire,True,none,none,False,none,not_attempted_no_entry,False,none,not applicable,True,-1.0,normal,none,"mild, short, hilar stricture measuring approximately 5 mm, extending from the hilum",none,none,single plastic stent visualized at the major papilla and successfully removed,none,False,none,-1.0,-1.0,-1.0,unknown,none,False,biliary,unknown,unknown,unknown,unknown,True,10 French into 15 cm plastic stent,none,False,none,none,none,none,False,0.0,none,none,"['Successful removal of prior 10 French into 15 cm plastic stent', 'Patent prior biliary sphincterotomy', 'Successful deep cannulation of bile duct with sphincterotome and guidewire', 'Cholangiogram revealed mild, short, hilar stricture measuring approximately 5 mm', 'Successful placement of new 10 French into 15 cm plastic stent']"
bdstricture02,openai,78,male,evaluation of biliary stricture leading to jaundice,unknown,unknown,"no definitive head of pancreas mass on imaging, no malignancy detected on previous pathology","normal main pancreatic duct, gluon-y gastric bypass anatomy, hepatico-jejunostomy, stent placed 4 weeks ago to treat jaundice",unknown,unknown,unknown,Olympus TJF Q180V,-1,not attempted,True,,,True,False,normal,none,none,without_difficulty,without detailed examination,normal,not visualized,none,False,none,False,False,not_applicable,none,not_visualized,none,False,none,none,not visualized,False,False,none,False,-1,none,ERBE electrocautery,spybite biopsies and biliary brushings,none,none,unknown,Visiglide 1,True,none,none,False,none,not_attempted_no_entry,False,none,not applicable,True,12.0,mildly dilated,none,2 cm distal CBD stricture with erythema and nodularity suggestive of malignancy,none,none,fully covered self-expandable metal stent had migrated,none,False,none,-1.0,-1.0,-1.0,none,none,False,biliary,unknown,unknown,unknown,unknown,True,none,8 cm FCSEMS placed across the HJ with approximately 4 cm extending into the jejunum,False,none,none,none,none,True,0.0,3 spybite biopsies and biliary brushings,none,"['Normal esophagus and stomach on limited views', 'Gastro-jejunostomy anastomosis was patent', 'Previously placed FCSEMS had migrated', '12 mm dilation of the common bile duct above a distal biliary stricture', '2 cm distal CBD stricture with erythema and nodularity suggestive of malignancy', '3 spybite biopsies and biliary brushings obtained', 'New 8 cm FCSEMS placed across the HJ with approximately 4 cm extending into the jejunum']"
spyglass02,openai,40,female,evaluation of bile duct and stent removal,unknown,"Patient presents with right upper quadrant, epigastric abdominal pain, acute elevation of liver enzymes, prior CT findings of cholangitis and contrast enhancing mass adjacent to the gallbladder.",Biopsy showed no malignancies and was found to be benign.,"Patient underwent EUS ERCP on 21st October last year, where a periportal ion was noted. During the ERCP, a cystic duct stone was identified and an ECE-7 stent was placed to prevent bleeding. The patient underwent a cholecystectomy on 23rd October last year, which showed chronic cholecystitis and gallstones.",unknown,unknown,unknown,Olympus TGF Q18DV,-1,not attempted,True,False,False,True,False,normal,metal bile duct stent in situ,The metal bile duct stent was visualized in position.,without_difficulty,with limited examination,normal,normal,none,True,widely patent,True,False,not_applicable,none,not_visualized,unknown,False,unknown,none,normal,False,False,none,False,-1,none,not specified,not specified,none,none,unknown,Visiglide,True,none,none,False,none,not_attempted_no_entry,False,none,not applicable,True,-1.0,unknown,none,none,none,none,metal bile duct stent was visualized in position,Cholangiogram shows no filling defects or stones in the bile duct.,False,none,-1.0,-1.0,-1.0,unknown,none,False,biliary,unknown,unknown,unknown,none,False,none,none,False,none,none,none,Good contrast and bile flow throughout the duct.,True,0.0,Multiple biopsies from the bile duct.,none,"['Normal esophagus and stomach on limited views', 'Metal bile duct stent removed without resistance', 'Widely patent biliary sphincterotomy', 'No filling defects or stones in the bile duct', 'Erythema around cystic duct takeoff and common bile duct, likely reactive changes', 'Multiple biopsies taken from the bile duct']"
spyglass01,openai,87,male,therapy for bile duct stone,unknown,"Patient has a history of Belgrath's 2 anatomy from a previous peptic ulcer disease surgery. He was recently hospitalized for sepsis, pneumonia and ascending cholangitis.",none,"COVID-19, atrial fibrillation, bladder, bradycardia with a pacemaker, CKD2, dementia, PEG dependence and vocal cord paralysis.",unknown,unknown,unknown,Olympus TJEQ18B,-1,not attempted,True,False,False,True,False,not_obtained,none,none,without_difficulty,with limited examination,normal,normal,none,True,unknown,True,False,not_applicable,none,not_visualized,unknown,False,unknown,none,evidence of prior sphincterotomy,False,False,none,False,-1,none,ERBE electrohydraulic lithotripsy,none,none,none,unknown,0.025 inch guide wire,True,none,none,False,none,not_attempted_no_entry,False,none,not applicable,True,-1.0,mildly dilated,"2 cm calculus in the distal bile duct, partially fragmented",none,none,none,previously placed bile duct stent removed without issues,none,False,none,-1.0,-1.0,-1.0,unknown,none,False,biliary,unknown,unknown,unknown,stone extraction,False,none,none,False,none,none,none,The bile duct is clear and there are no further interventions needed at this time.,True,0.0,none,none,"['Normal esophagus and stomach on limited views', 'Successful removal of previously placed bile duct stent', '2 cm calculus in the distal bile duct, partially fragmented', 'Successful electrohydraulic lithotripsy and stone removal', 'No remaining stones or filling defects on occlusion cholangiogram']"
pdstone02,openai,41,female,treatment of alcoholic chronic obstructive pancreatitis with a large stone in the head of the pancreas,unknown,"The patient initially presented with abdominal pain, nausea, and vomiting.",none,alcoholic chronic obstructive pancreatitis,unknown,unknown,unknown,JFQ180B,-1,successful,True,,,False,True,normal,none,none,unknown,with detailed examination,normal,normal,none,False,none,False,False,not_applicable,none,not_visualized,unknown,False,none,none,normal,False,False,none,False,-1,none,blended electro-surgical current,not specified,none,none,unknown,Visiglide 1,False,none,none,False,none,intentional,True,standard wire-guided,not applicable,True,-1.0,none,large stone in the head of the pancreas,none,none,none,none,none,True,"tortuous and dilated main pancreatic duct with large, obstructive filling defects in the head",-1.0,-1.0,-1.0,unknown,none,False,pancreatic,unknown,unknown,complete,stone extraction,False,none,none,False,none,none,none,none,False,0.0,none,none,"['Normal esophagus and stomach on limited views', 'Successful cannulation of the main pancreatic duct', 'Tortuous and dilated main pancreatic duct with large obstructive filling defects in the head', 'Large stone in the head of the pancreas', 'Complete pancreatic sphincterotomy performed with self-limited bleeding', 'Fragmentation of large stone using EHL at medium power', 'Unable to deeply advance guidewire past obstructing stone']"
pdstone01,openai,69,male,therapy of a pancreatic duct stricture and stent,unknown,"Patient presents with decreased appetite and abdominal pain, but no fever or leukocytosis.",no fever or leukocytosis,"metastatic hepatosplenic carcinoma, chronic constipation, pancreatic duct stricture, stone, extensive tobacco use, recent acute pancreatitis",unknown,unknown,"extensive tobacco use, approximately 100 pack years",Olympus TJF Q180B,-1,successful,True,,,True,False,normal,none,none,without_difficulty,without detailed examination,normal,normal,none,False,none,False,False,not_applicable,none,normal,normal,False,none,none,normal,False,False,none,False,-1,none,ERBE electrocautery,none,none,none,none,Visiglide 0.025 inch,False,none,none,False,none,intentional,True,standard wire-guided,not applicable,True,-1.0,none,multiple calcified calculi in the dorsal pancreatic duct,none,none,none,none,none,True,"dilation, stones, incomplete pancreas divisum",-1.0,-1.0,-1.0,dilated,none,False,pancreatic,none,none,none,none,False,none,none,False,none,none,none,none,True,0.0,none,none,"['Normal esophagus and stomach on limited views', 'Normal major and minor papilla', 'Successful pancreatic duct cannulation with sphincterotome and Visiglide wire', 'Mildly dilated dorsal pancreatic duct with minimal side branch dilation', 'Multiple calcified calculi in the dorsal pancreatic duct', 'Electrohydraulic lithotripsy performed to fragment pancreatic duct stone', 'Clear pancreatic duct with no remaining stones after procedure']"
bdstone03,openai,87,male,bile duct stone,unknown,Patient has a history of bile duct stone confirmed by CD and was transferred for ERCP in the setting of altered anatomy.,none,"Bilirath to anatomy for PUD from the 1980s, COVID positive in August 2020, atrial fibrillation flutter not on anticoagulant drugs, bradycardia status post-pacemaker in 2017, CKD2 baseline nonverbal dementia, PEG dependent, vocal cord paralysis from thyroidectomy in 1995, sepsis secondary to multilobar aspiration pneumonia and ascending coli diagnosis with E. coli sepsis.",unknown,unknown,unknown,Olympus TJF Q180B,-1,not attempted,True,False,False,True,False,normal,none,none,without_difficulty,with detailed examination,normal aside from the bilirath to anatomy,normal,none,True,unknown,True,False,not_applicable,none,not_visualized,unknown,False,unknown,none,normal,False,False,none,False,-1,none,ERBE electrohydraulic lithotripsy,stone retrieval balloon,none,none,unknown,0.025 inch guide wire,True,none,none,False,none,not_attempted_no_entry,False,none,not applicable,True,-1.0,mildly dilated,"2 cm calculus in the distal bile duct, partially fragmented",none,none,none,Previously placed bile duct stent in place,none,False,none,-1.0,-1.0,-1.0,unknown,none,False,biliary,unknown,unknown,unknown,stone extraction,False,none,none,False,none,none,none,No residual stones or filling defects,True,0.0,none,none,"['Normal esophagus and stomach aside from the bilirath to anatomy', 'Successful removal of previously placed bile duct stent', 'Successful biliary cannulation and stone extraction', '2 cm calculus in the distal bile duct, completely fragmented with electrohydraulic lithotripsy', 'No residual stones or filling defects on occlusion cholangiogram']"
bdstone02,openai,44,female,"treatment of abdominal pain of suspected biliary origin with bile duct stones and gallbladder stones, biliary dilation on ultrasound and an abnormal MRCP",unknown,none,none,none,unknown,unknown,unknown,Pentax ED3490TK,-1,successful,True,,,True,False,normal,none,none,without_difficulty,with limited examination,normal,normal,none,False,none,False,False,not_applicable,none,not_visualized,none,False,none,none,"normal, bile draining",False,False,none,False,-1,none,ERBE electrocautery,not specified,none,none,not specified,not specified,True,Multiple attempts were required with inadvertent pancreatic duct access,needle-knife precut,False,none,intentional,True,standard wire-guided,not applicable,True,-1.0,normal,A stone in the distal common bile duct,none,none,none,none,none,True,normal,-1.0,-1.0,-1.0,normal,none,False,biliary,needle-knife,not specified,not specified,adequate bile flow,True,7 French x 4 cm Cook Zimmon double pigtail biliary plastic stent,none,True,pep_prophylaxis,5F x 3 cm Boston Scientific Advantage pancreatic plastic stent,Single pancreatic stent placed for post-ERCP pancreatitis prophylaxis. Single biliary stent placed.,Bile and contrast drained well,True,0.0,none,none,"['Normal stomach visualization', 'Normal major papilla with bile draining', 'Pancreatic duct cannulated before bile duct', 'Multiple unsuccessful attempts at biliary cannulation', 'Needle knife papillotomy performed', 'Deep cannulation of bile duct achieved', 'Cholangiogram reveals stone in distal CBD', 'Stone extracted using balloon', '7 French x 4 cm Cook Zimmon double pigtail biliary plastic stent placed', '5F x 3 cm Boston Scientific Advantage pancreatic plastic stent placed for post-ERCP pancreatitis prophylaxis']"
