file,pred_transcript
cyst03," This is Dr. Venkatakshan Thala dictating the procedure for an upper endoscopic ultrasound with fine needle aspiration and EGD, esophageal gastrodiadnoscopy with biopsy performed on a female patient, test for whose date of birth is the 20th of August 1981 and medical record number is 3446548. The procedure is being conducted at the Johns Hopkins Bayview Medical Center and today is the 17th of January 2025. The patient is a 62-year-old female who is presenting for evaluation of GERD and an incidentally discovered pancreatic head cyst on previous imaging. We're using the EG29I10 and EG34J10U endoscopes. We're now commencing the procedure and I'm now introducing the high def endoscope through the mouth and advancing it under direct visualization. As I pass the scope through the esophagus, I can observe a LA grade C esophagitis with mucosal breaks involving more than 75% of the circumference. But I can't see any deep ulcerations. It's involving 75% of the circumference but without deep ulcerations. There is also a 2 cm high atel hernia. It could be classified as a Hill Grade 3. There is no proximal inlet patch that I can see. The esophageal mucus otherwise appears to be normal with no nodularity, strictures, or masses. I'm biopsying the mid and the proximal esophagus to rule out eosinophilic esophageitis. The gastroesophageal junction is noted at 33 centimeters from the incisors with a diaphragm pinch noted at 35 centimeters. I'm now advancing the scope into the stomach. The gastric mucosa appears to be normal with no ulcers, erosions, or mast lesions. I'm taking random biopsies here to rule out helicobacter pylori infections. I'm now continuing to advance the scope into the first and second portions of the duodenum, where the mucosa appears to be normal here without any erythema, ulcerations, or villous blunting. I'm now drawing the gastroscope and introducing the echo-endoscope from the patient's mouth. I'm now passing to the oesophagus. The mucus remains unchanged from prior evaluation, just the L.A. grati esophageitis that can be noted. The scope is advanced in the stomach and I'm now pushing the endoscope in the second portion of the diurnum to visualize the pancreas beginning at the head and I'm trying to trace it to the tail. The pancreatic parenchyma appears to be homogeneous with mild diffuse fatty infiltration. A cystic complex can be seen in the head of the pancreas with a large cystic component measuring 29.6 mm x 19.9 mm. The cyst has no mural nodules, no gasification and no obvious connection with the main pancreatic duct. I'm using a 22 gauge aspiration needle to perform FNA. I can confirm using color Doppler that no intervening vascular structures are present. Before beginning the puncture, beginning the first pass, I'm able to obtain about 60 c clear viscous fluid that I've aspirated. Oh, two grams of IV of cefetetan was administered prior to the puncture, just for good measure for infection prophylaxis. The main pentatonic duct appears to be normal and measures about 3.0 millimeters in the head and 1.3 millimeters in the body and 0.6 millimeters in the tail. I'm now visualizing the biliary tree. I can see that the common bile duct is now dilated and it measures about 5.1 millimeters just below the hilum with no stone strictures or abnormalities. The gallbladder appears normal but I can see some microlithiasis without mural thickening or pericollis cystic fluid. No peripancreatic, periportal or celiac access lymph nodes can be visualized. I'm now visualizing the liver and the portions that I'm visualizing in the liver demonstrated hepatic steatosis with mild blunting of the liver edge. There are no mass lesions or intrahepatic biliary ductal dilation. I can't see any ascites or nodular dipostas either. I'm beginning withdrawal of the scope and re-evaluating the visualized structures on withdrawal. Withdrawal is almost complete and there's no evidence of bleeding. Withdrawal is now complete. There's no immediate complications. The patient appears to be stable. The estimated blood loss is none. This is the end of procedure."
cyst01," This is Dr. Venkata Akshantala dictating the procedure for an operantoscopic ultrasound with fine needle aspiration performed on a female patient with the date of birth of August 20, 1981 and medical record number XXXX. The procedure was conducted on September 17, 2024 at the Johns Hopkins Bayview Medical Center. The patient presented for evaluation of an incidentally detected pancreatic cyst noted on a CTA dated August 30, 2024. The imaging revealed a 1 cm subtle hyperdensity in the body of the pancreas and a possible 1.2 cm exophytic lesion in the head of the pancreas. A prior CT scan from July 27 of this year showed a mildly atrophic pancreas without ductal dilation, likely age-related. There is no history of any prior endoscopic ultrasound procedures. I'm today using a Olympus GF UCT 180 EUS Curly Linear Ultrasound Endoscope. Serial number is 713-5502. And I'm now beginning the procedure. The scope is in. I'm introducing it through the mouth and advancing it carefully through the esophagus now. and I'm now in the stomach and into the second portion of the duodenum. During advancement, I observed the lumen and the surrounding structures, and I can see that there are no abnormalities of any kind. Once the scope... Yeah, the scope is now in the stomach, and I'm infusing water. I'm using a 7.5 megahertz frequency. Today, for imaging of the pancreas, I am able to see multiple anechoic lesions consistent with pancreatic cysts. The largest cyst is in the proximal body around the neck of the pancreas and it measures about 1.1 cm x 0.65 cm. There appear to be no mural nodules or solid components within the cyst, but I can see a thin septation. I'm performing a fine needle aspiration using a 22 gauge needle. FNAC is now complete. I'm using color Doppler to confirm that there are no intervening vascular structures prior to the puncture. FNAC was completed using a single pass. There seems to be minimal fluid, but I'm sending it for molecular marker testing anyway. On the pancreas I can also see a 4.8 mm x 6.4 mm cyst in the pancreatic head. I am able to see a cyst in the uncinate process as well. It measures about 8.6 mm x 9.6 mm. I am also able to see another cyst in the pancreatic head. That is about 8.7 mm x 5.3 mm. There seems to be a 1.5 mm septation within the cyst. There seems to be a cluster of sub-centimeter cysts in the body. The largest measures 6.2 mm cross 3.3 mm. In the tail of the pancreas now, there seems to be a 7.9 mm cyst. the main pancreatic duct is appears to be normal in diameter it measures about 1.4 millimeters in the head it's under two millimeters in the body and about one millimeter in the tail there seems to be no evidence of duct wall thickening there's no strictures no stones not any mural nodules there seems to be some amount of myolabularity in atrophy with echogenic foci and stranding. Moving to the bile duct, it appears to be normal. It measures about 3.1 mm. The gallbladder appears to be normal. The duodenum appears to be normal as well. There seems to be no peripancreatic lymphadenopathy. I'm able to visualize the liver and it appears to be normal as well. On withdrawal at the scope I'm able to see that the stomach and the esophagus are normal as well. I'm now retracting the scope completely. The scope is out. The procedure is now complete. There seems to be no immediate complications and there seems to be very very minimal blood loss this is the end of procedure"
cancer01," Today is the 17th of September 2024 and this is Dr. Venkatakshan Thala dictating the procedure for an upper endoscopic ultrasound performed on a female patient whose date of birth is August 20th 1981 and medical record number is three four four six five four eight we're here with a 62 year old female who's undergoing an endoscopic ultrasound as part of her pancreatic screening in the context of her BRCA1 mutation the patient has no family history of pancreatic cancer adenoma sorry pancreatic adenocarcinoma though the her family history details are limited she is participating in the caps protocol uh with an mrcp that is pending uh we're now going to begin the procedure the patient is sedated and i'm now introducing an a corendoscope through the patient's mouth. The scope is being advanced under direct visualization. Advancing the scope through the esophagus, the mucosa appears normal with no evidence of any kind of strictures, erosions or masses. I'm now passing the scope into the stomach. The gastric mucosa appears to be normal. There appears to be no ulcers, erosions, or abnormalities of any other kind. I'm advancing the scope through the pylorus and into the first portion of the duodenum. The mucus appears to be normal. I'm continuing to advance the scope into the second portion of the duodenum, I'm positioning the endoscope adjacent to the ampulla for better imaging of the pancreas. I'm infusing water to provide a better interface for higher resolution imaging. I'm beginning to visualize the pancreas, beginning at the head. I'm able to trace the pancreas from the head all the way to the tail. I'm visualizing this from the second portion of the duodenum. The parenchyma of the head shows nonspecific hyperechoic focae and strands. The main pancreatic duct in the head measures about 2.2 millimeters and is not dilated. There appears to be no ductal thickening, mucin stones, or masses, or abnormalities of any other kind. I'm slightly retracting the scope visualize the pancreatic neck. The pancreatic duct here measures about 1.4 millimeter and appears to be normal. As I continue with drawing the scope I'm assessing the pancreatic body. The duct here measures about 1.2 millimeters in this region and is normal. In further extraction of the scope I'm able to visualize the tail. The main pancreatic duct here in the tail measures about 0.8 millimeters. The panetama continues to show hyper-echoic foci and strands, but there seem to be no concerning features like masses, frictions or stones. Overall the main panetama duct tapered smoothly and no dilated branches, branch ducts are identified. Since I'm here I'm visualizing the common bile duct which measures about 2.9 mm in diameter. It also appears to be normal. There seems to be no wall abnormalities or stones or any other abnormal findings. As part of the CAHPS protocol, I'm collecting secretions from the diurnum. I am retracting the scope to evaluate the gallbladder. It appears to be normal. There seems to be no wall thickening or stones or any pericardial cystic fluid. There seems to be no peripancreatic lymphadenopathy either. And now I'm visualizing the liver. It appears to be normal with no focal lesions or any abnormalities. As I'm now withdrawing the scope. I'm revaluating the the diurnal and the stomach and the mucus appears to be normal. I'm in the esophagus now as I'm withdrawing the scope and the mucus appears to be normal as well. There seems to be no evidence of inflammation. Some masses are also of any kind. The scope is out. There seems to be no immediate complications of any kind. The estimated blood loss appears to be very minimal. This is the end of procedure."
cyst02," Today is the 17th of September 2024 and this is Dr Venkatakshanthala dictating the procedure for an upper endoscopic ultrasound with fine needle aspiration with color Doppler. On a male patient whose date of birth is August 20th 1981 with MR number 666666. This is a 69-year-old male patient presenting for an evaluation of a pancreatic cystic lesion. The patient has a significant past medical history of esophageal cancer, left breast cancer, and adrenal cortical adenoma and adrenal hyperplasia. A pancreatic protocol CT from December 30, 2023 revealed a 1.8-centimeter pancreatic body cyst with a questionable thin septation. The lesion has increased in size since 2019 and is suspected to be a side branch IPMN. We're now beginning the procedure. I'm introducing the gastroscope. It's an Olympus GIF HQ190 gastroscope. and introducing it through the mouth. I'm advancing it through the esophagus and through the stomach. I'm observing the lumen as I proceed. The esophageal mucosa appear to be normal. There seems to be no evidence of inflammation. There seems to be no strictures or masses. Being the stomach now, the gastric mucosa also appears to be unremarkable with no ulcers or erosions or masses of any kind. I'm now advancing into the duodenum. I'm in the second portion of the duodenum and I'm beginning to evaluate the pancreas using a linear echoendoscope. The pancreatic parenchyma, I'm evaluating it beginning with the head. At the head of the pancreas, it appears to be myelolabular with echogenic foci and strands consistent with chronic changes. The main pancreatic duct in the head measures about 1.3 mm and is not dilated. I'm able to see a cyst in the head and the uncinate region that's about 7 mm in size, appears to be single chambered. It has thin walls, there's no septation, there are also no mural nodules and there appear to be no calcifications. There seems to be no evidence of communication between the cyst and the main pancreatic duct. I'm retracting the scope slightly to well with the pancreatic neck and body. The largest cyst seems pretty large this seems to be in the distal body of the pancreas. It measures about 23.7 millimeter across 13.8 millimeter. It's a multi-luculated cyst with thin septations and thin walls. There are no mural nodules or calcifications in the cyst. I am confirming with Doppler imaging and I can say that there are no intervening vascular structures. Using a 22 gauge fine needle, I am performing a single pass under Realtri ultrasound guidance to aspirate fluid from the cyst. I'm able to aspirate about 3 millimeters. I'm sending this fluid over for molecular marker analysis, CEA and glucose anomalies level analysis as well. The cyst is not collapsing post-aspiration and about 8.3 millimeter residual portion remains. I'm further tracking the scope to evaluate the pancreatic tail. A single well-defined thin walled cyst can be seen here. It's about 3.0 mm. There are no mural nodules or septations or calcifications of any kind. It doesn't seem to communicate with the main pancreatic duct. Talking of the main pancreatic duct, it can be traced from the head to the tail. it's about 1.3 millimeters in the head it doesn't seem to be dilated measures about 2.5 millimeters in the neck and about 1.3 millimeters in the tail there seems to be no abnormalities of any kind in the pancreatic duct main pancreatic duct and there are no strictures stones or thickening that can be identified. Oh I am now visualizing the biliary tree and the common bile duct appears to be normal with no evidence of dilation, stones or wall thickening. It appears to be three millimeters in diameter. I'm now withdrawing the endoscope. Under traction, the diodenum appears to be normal. I'm reevaluating the stomach as well. The gastric mucosa appears to be normal and so does the esophagus. There were no abnormalities of any kind noted in the visualized portions of the upper GI tract. I'm now withdrawing the scope. The scope is out. There appear to be no immediate complications and the blood loss appears to be very minimal. This is the end of procedure."
cancer02," This is Dr. Venkat Akshantala dictating the procedure for an upper endoscopic ultrasound performed on a female patient whose date of birth is August 21st, 1982. And the medical record number is 3446548. Today is the 17th of September, 2024, and the procedure is being conducted at the Johns Hopkins Bayview Medical Center. We are here with a 51 year old female patient who is undergoing an upper endoscopic ultrasound as part of her pancreatic cancer screening due to an ATM mutation. The patient has a history of thymoma and mastectomy. There is no family history of pancreatic adenocarcinoma. The patient is sedated now and I'm commencing the procedure. I'm introducing the echo endoscope through the patient's mouth and advancing under direct visualization. Now advancing the scope through the esophagus, the mucus appears to be normal without evidence of any strictures, erosions or masses. I'm now advancing the scope into the stomach. The gastric mucus appears to be normal. I'm now advancing the scope through the pylorus into the first portion of the duodenum. The mucus here appears to be normal as well. I'm now in the second portion of the duodenum and I'm positioning it adjacent to the ampulla for better optimal imaging of the pancreas. I'm beginning to systematically visualize the pancreas. The parenchyma appears to be normal in general. And there seems to be no evidence of hyper-echoic foci stranding or lobularity. At the head, the main pancreatic duct measures about 1.3 millimeters. It doesn't appear to be dilated. There seems to be no abnormalities of any kind, no ductal wall thickening, mucinous stones. I'm advancing the scope slightly to evaluate the body of the pancreas. The main pancreatic duct here measures 1.7 mm and appears to be normal. I am retracting the scope to visualize the tail. The main PD in the tail measures about 0.9 mm. It tapers smoothly. There seems to be no dilation abnormalities here. The entire duct can be traced from the ampulla and shows no evidence of any strictures, tones, thickening or masses. There are no dilated branch ducts or pancreatic cysts that I can identify. Since I'm here in the second portion of the diurnum, I'm visualizing the common bile duct. It appears to be normal. There seems to be no dilation. It's about 1.4 millimeters in diameter. As part of the CAPS study protocol, I'm collecting secretions from the diurnum using the scope. While withdrawing the scope, I can see that the stomach and the duodenum are normal and the esophagus is normal as well, though I admit there is limited visualization. I am now withdrawing the scope. The scope is out. The procedure is now complete. There seems to be no immediate complications of any kind. The blood loss appears to be minimal. This is the end of procedure."
cyst06_vocals," This is Dr. Venkatakshan Thala dictating a procedure for an upper endoscopic ultrasound performed on a female patient, Tess06, whose date of birth is 20th of August, 1981, and the medical record number is 3446548. The procedure is being conducted at the Johns Hopkins Oslo Center, and today is the 7th the January 2025. The patient's a 70-80 year old female who's undergoing surveillance for multiple pancreatic cysts that were initially detected on a cardiac CD in December of 2020. Genetic testing was negative and she remains asymptomatic. The previous EUS in 2021 demonstrated multiple cysts including a 19 mm cyst in the body, a 21 x 4.9 mm cyst in the anterior process, a 9 mm cyst in the body, a 17 mm cyst in the tail, a 13 mm cyst in the neck, and a 11 mm cyst in the head with no pancreatic duct dilation. Her most recent MRI and MRCP was on 11th of October in 2023 which confirmed multiple pancreatic cysts without apparent nodular or enhancing features with a serpaginous dilated duct in the uncinate process measuring about eight millimeters. Patient has declined EUSFNA unless worrisome features are detected. She's Ashkanat Kikurish with cholera GD negative and a maternal cut-cultant with pancreatic cancer. She has declined participation in the CAP study. We are using an Olympus GF-UCT180 scope today. I'm advancing this scope under direct visualization after introducing it through the mouth into the esophagus. As I pass the scope through the esophagus, mucus appears to be normal with no strictures or erosion or nodularity. I'm advancing the scope into the stomach, which appears to be normal, with no ulcers, erosions, or mastilations. I continue advancing the scope into the first and second portions of the diadenum, where the mucous appears to be normal, without erythema, villus, blunting, or ulcerations. I am now pushing the endoscope into the second portion of the diadenum to perform a systematic evaluation of the pancreas and the surrounding structures. Visualizing the pancreas, beginning of the head and tracing it to the tail. The pancreatic parenchyma shows mild atrophy near the neck and the proximal body with focal fatty infiltration and lobularity, particularly in the pancreatic body. The main pancreatic duct was not dilated in the body and the tail, but a few are somewhat dilated in the neck and head, measuring 6.3 mm in the neck and 5.3 mm in the head. The duct is traced to the ampulla, showing a smooth taper with no evidence of echogenic duct wall thickening, mucin, mathletion, and stricture of stones. No dilated ducts can be visualized. Multiple pancreatic cysts can be identified throughout the pancreas. In the pancreatic tail, there are cysts that measure 3.3 mm, 3.1 mm, 8 mm, 20.8 mm. another one that measures 9.9 millimeters and another one that measures 12.3 millimeters all these cysts are well defined uh they're single chamber uh they're thin walled uh without septation from neural nodules uh there's a 14.3 millimeter uh pancreatic sits in the neck of the pancreas uh with a thin septum that's uh well defined uh uh with it with the thin system and septum and sorry and the the cyst is well defined without any more neural nodules The cyst in the pancreatic head measures about 5.3 mm, is single chambered, well defined, and is thin walled without mural nodules. I can't see any calcifications or any obvious communication with the main pancreatic duct in any of the crypts. I am now visualizing the biliary tree. The common bile duct appears to be normal in caliber and appearance, with no strictures or stones. The gall gland appears to be normal as well, with no wall thickening stones or predipolycystic fluid. There are no peripancreatic, perigastric or celiac axis lymph nodes that can be visualized by me. I'm visualizing the liver now. The visualized portions of the liver appear to be normal, with no focal lesions or abnormalities. I can't see any ascites or nodular deposits. To me the left adrenal gland appears to be normal. I'm beginning withdrawal at the scope and I'm revaluating all the structures on my way back. On withdrawal, I'm unable to identify any other abnormalities other than the ones I've previously mentioned. Scope is out. There's no evidence of bleeding or any immediate complications. The patient appears to be stable. The estimated blood loss is minimal. This is the end of the video"
