file,pred_transcript
cyst10_vocals," This is Dr. Venkatakshan Thala, detailing the procedure for an operandoscopic ultrasound with fine needle aspiration and needle-based confocal laser endomicroscopy performed on a female patient, test 10, with date of birth of August 20, 1981, and medical record number 3446548. The procedure is being conducted at the Johns Hopkins Baby Medical Center on January 17, 2025. That's today. And we're here with a 61-year-old female patient who's presenting for surveillance of a pancreatic head or uncinate cyst. She previously underwent an EUS on 27th of January in 2023, which demonstrated a 0.7-centimeter cyst in the pancreatic body and a 5.4 x 3.7 cm cyst in the pancreatic head or incident process with a mixed macro-microcystic appearance, which was suggestive of a serious cystadenoma. EOSFNA performed at the time was negative for CEA and cytologists showed a mucin. Given these findings, the cyst was likely consistent with a serious cystadenoma. The patient is returning today for ongoing surveillance. so I'm now commencing the procedure I'm using a Olympus GF-UC-T180 ultrasound US ultrasound sorry I'm introducing the scope through the mouth and advancing it under direct visualization into the esophagus the mucus here appears to be normal with no nodularis or erosions or strictures that I can identify as I advance the scope into the stomach it appears to be normal I can't see any ulcers or erosions or mass lesions. I continue advancing the scope into the first and second portion of the diadenome, where the mucus appears to be normal, without any erythema, villus, blunting, or ulcerations. I'm pushing the scope in the second portion of the diadenome to perform a systematic evaluation of the pancreas and the surrounding structures. I'm visualizing the pancreas beginning at the head and tracing it to the tail. The pancreatic pancrema shows my lobularity and fatty infiltration, particularly in the pancreatic body and tail. I can note some amount of echogenic phoca and stranding. The main pancreatic duct is not dilated, measures about 2.2 millimeters in the neck and 1.4 millimeters in the body. The duct can be traced to the ampulla and shows a smooth taper with no evidence of echogenic duct wall thickening. There are no strictures or stones in the duct, no masses or no mass lesion or mucin either. I can't visualize any dilated branch ducts. I can see a 48.7 millimeter across 49.2 millimeter lesion in the pancreatic head or uncinebrosis. The lesion has a primarily microcystic appearance with some macrocystic components. Thin walls seem to separate the compartments with no evidence of calcification. or a central scar. There's no direct communication of the main pancreatic duct that I can observe. I'm beginning the final aspiration. I'm using a 19-gauge expect needle. I'm using color Doppler to confirm the absence of intervening vascular structures. I'm in. I only performed a single pass. Antibiotics were administered before the puncture for infection prophylaxis. NCLE is being performed now. I administered a 5-amyl of fluorescein dye before the NCLE. On NCLE, no epithelial structures or papillary projection can be visualized. Fine capillaries with a foreign pattern are noted. This is consistent with a serous cystadenoma. I'm visualizing the biliary tree. the common bile duct appears to be normal in caliber and appearance. There's no stones or stitches. There appear to be no peripancreatic, perigastric, or celiac axis lymph nodes that can be visualized. I'm visualizing the liver, and the visualized portion of the liver appear to be normal, with no focal lesions or abnormalities. The adrenal gland is what I'm seeing now, and the left adrenal gland appears to be normal. I'm beginning withdrawal of the scope now. I'm revaluating all the previously visualized structures on my way back. On withdrawal, there appear to be no other abnormalities than the ones I've previously mentioned. There appears to be no evidence of bleeding. The scope is out. The patient appears to be stable. There appears to be no immediate complications. The estimated blood loss is minimal. And this is the end of the procedure."
cyst04_vocals," This is Dr. Venkatesh Chintala dictating the procedure for an upper endoscopic ultrasound with a fine needle aspiration and esophageal gastrodiagnoscopy. AGD performed on a male patient. Test phi due date of birth is the 20th of August 1981 and medical record number is 3446548. The procedure is being conducted at the Johns Hopkins Bayview Medical Center on the 7th of January, 2035. The patient is a 71-year-old male who is presented for evaluation of pancreatic cysts. We are using an Olympus GFU CT180 and an Olympus GIFH2190 gastroscope today. Now commencing the procedure. I'm introducing the gastroscope to the mouth and advancing it under direct visualisation. As I pass the scope to the oesophagus, I can see that the mucosa feels normal. I can't see any erosions, nodularies or strictures. I'm now advancing the scope in the stomach, where I can observe a bulge with erythema, likely from an adjacent pseudocyst. There is no evidence of active bleeding or alterations of mastocytosis. I can hear advancing into the first and second portions of the duodenum, where the mucus appears normal without any of the immobility blunting or alteration. I am now withdrawing the gastroscope and introducing the endoscope. The mucus remains unchanged from prior evaluation in the oesophagus. As the scopus is being advanced into the stomach, there's no changes here as well, other than the previously mentioned abnormality. I'm now in the urethrum and I'm now beginning to crystallize pancreatics, beginning at the head and tracing to the tail. No pancreatic masses can be identified. The pantheric paradigm shows a pure ectogenic foci and spanning, but otherwise it's unremarkable. The main pantheric ducts of the MPD is not dilated and measures about 3 mm in the neck of the pantherias. The duct wall is not ectogenic and there are no dilated side branches. The paradigm of calcification shows that the mammal is in the outer border of the MPD. There are no parenteral calcifications or any other abnormalities in the outer border. I can see multiple pancreatic cysts which seems to be consistent with multifocal branched of IPMN. There is a pancreatic body cyst. The first pancreatic body cyst is about 29 millimeters in diameter with possible ductal communication. There seems to be some mucin debris and a hyperacquired rim, but I can't see any solid or any other containing features. The second pancreatic body cyst is about 6 millimeters in length, also containing mucin debris with a hyper-echoic rim. The third pancreatic body cyst is about 4 millimeters in diameter. And as a pancreatic tail cyst, it's about 4.5 centimeters. It's well-defined, filled with debris, and likely is a pseudocyst. Now that I've identified the cysts, I'm beginning FNA using a 22 gauge needle. I'm beginning with the 29 mm pancreatic body cyst. I'm aspirating clear fluid from this. I only use a single pass. I'm now performing an FNA into the second pancreatic body cyst, the 6mm one. I'm aspirating clear fluid here as well, but it's only a relatively small amount of clear fluid. I'm now beginning FNA on the 4.5cm cyst of the pancreatic tail. single pass and I'm able to aspirate debris filled fluid. I'm now trying to visualize a bilirubin tree. I can trace the bile duct from the hilum to the ampulla. It appears normal in caliber with a thin duct wall and no dilation or stone-coated features. The gallbladder appears to be filled with microlithiasis but there's no sludge, neurofitting or periphylicistic fluid. I'm able to visualize the left adrenal gland and it appears to be normal. The visualized portions of the aira and the c-lake actus appear to be normal with no aneurysms found by abnormal vascular structure. The left lobe of the liver that I'm able to visualize appears to be normal as well. There's no focal lesions or suspicious findings here. The visualized portions of the spin appear to be normal as well. I'm beginning withdrawal of the endoscope. and we're evaluating the previously visualized structures given with the valve. There's no evidence of bleeding and the scope is out. There seems to be no immediate complications. The patient appears to be stable. The estimate of blood loss is minimal. This is the end of procedure."
cyst01_vocals," This is Dr. Venkata Akshantala dictating the procedure for an operantoscopic ultrasound with fine needle aspiration performed on a female patient with the date of birth of August 20, 1981 and medical record number XXXX. The procedure was conducted on September 17, 2024 at the Johns Hopkins Bayview Medical Center. The patient presented for evaluation of an incidentally detected pancreatic cyst noted on a CTA dated August 30, 2024. The imaging revealed a 1 cm subtle hyperdensity in the body of the pancreas and a possible 1.2 cm exophytic lesion in the head of the pancreas. A prior CT scan from July 27 of this year showed a mildly atrophic pancreas without ductal dilation, likely age-related. There is no history of any prior endoscopic ultrasound procedures. I'm today using a Olympus GF UCT 180 EUS curly linear ultrasound endoscope. Serial number is 713-5502. And I'm now beginning the procedure. The scope is in. I'm introducing it through the mouth and advancing it carefully through the esophagus now and i'm now in the stomach and into the second portion of the duodenum during advancement i observe the lumen and the surrounding structures and i can see that there are no abnormalities of any kind once the scope yeah the scope is now in the stomach and i'm infusing water I am using a 7.5 MHz frequency today for imaging of the pancreas and I am able to see multiple anechoic lesions consistent with pancreatic cysts. The largest cyst is in the proximal body around the neck of the pancreas and it measures about 1.1 cm x 0.65 cm. There appear to be no mural nodules or solid components within the cyst but I can see a thin septation. I am performing a fine needle aspiration using a 22 gauge FNAC is now complete. I'm using color Doppler to confirm that there are no intervening vascular structures prior to the puncture. FNAC was completed using a single pass. There seems to be minimal fluid but I'm sending it for molecular marker testing anyway. On the pancreas I can also see a 4.8 millimeter by 6.4 millimeter cyst in the pancreatic head. I'm able to see a cyst in the uncinate process as well. It measures about 8.6 millimeters by 9.6 millimeters. I'm also able to see another cyst in the pancreatic head that is about 8.7 millimeters cross 5.3 millimeters there seems to be a 1.5 millimeter septation within the cyst there seems to be a cluster of sub-centimeter cysts in the body the largest measures 6.2 millimeters cross 3.3 millimeters in the tail of the pancreas now there seems to be a 7.9 millimeter cyst The main pancreatic duct appears to be normal in diameter. It measures about 1.4 mm in the head, it's under 2 mm in the body and about 1 mm in the tail. There seems to be no evidence of duct wall thickening, there's no strictures, no stones, not any mural nodules. There seems to be some amount of myelobularity in atrophy with echogenic foci and stranding. Moving to the bile duct, it appears to be normal. It measures about 3.1 millimeters. The gallbladder appears to be normal. The diurnum appears to be normal as well. There seems to be no peripancreatic lymphadenopathy. I'm able to visualize the liver and it appears to be normal as well on withdrawal of the scope I'm able to see that the stomach and the esophagus are normal as well I'm now retracting the scope completely the scope is out the procedure is now complete there seems to be no immediate complications and there seems to be very very minimal blood loss this is the end of the procedure"
cyst09_vocals," This is Dr. Venkatakshanthala dictating the procedure for an upper endoscopic ultrasound with fine needle aspiration performed on a male patient, test 09, with a date of birth of 20th August 1981 and medical record number 3446548. The procedure is being conducted at the Johns Hopkins Baby Medical Center and today is the 17th of January 2025 and we're here with a 57-year-old male who's present for the surveillance of an incidentally detected pancreatic cyst on MRI. The patient has no family history of pancreatic cancer. After discussing the risk benefits and alternatives, informed consent was obtained. We're using a Olympus GFU CT 180 ultrasound. I'm passing the scope to the esophagus and commenting the procedure. As I introduce the scope through the mouth and advancing it under direct visualization and since I'm already in the esophagus, mucus appears to be normal. There are no strictures, nodularity, or erosions. I'm advancing the scope in the stomach. It appears to be normal and there's no ulcers, erosions, or mastitis. I'm continuing to advance the scope into the first and the second portion of the diurnum, where the mucus is supposed to be normal, without erythema, villus, blunting, or ulcerations. I'm now pushing the scope into the second portion of the diurnum to perform a systematic evaluation of the pancreas and the surrounding structures, beginning at the head and tracing it to the tail. The pancreatic parenchyma shows scattered foci, strands, and myelobularity, but no discrete masses or calcifications or discrete mass stations. uh the main planet the main pancreatic duct is not dilated uh it measures about 1.2 millimeters in the head 0.8 millimeters in the body and uh in the tail it measures about 0.7 millimeters uh the ducts i'm tracing the duct to the ampulla it shows a smooth taper with no evidence of echogenic ductal thickening uh there are no uh strictures or stones in the duct uh there are no mass lesions i'm using either uh i can't visualize any dilated branch ducts though i can identify two pancreatic cysts. The pancreatic body cyst measures about 4.2 millimeters. It's well defined, single chambered, thin wall without septations of neural nodules. There are no calcifications and no communication of the main pancreatic duct. The pancreatic neck cyst measures 4.2 millimeters across 3.7 millimeters. It's well defined, single chambered, it's thin wall without any septations of neural nodules, no calcifications and no communication of the main pancreatic duct. I'm visualizing the biliary tree now. The common bile duct is normal in caliber measuring about 2.6 millimeters. No strictures, stones or abnormalities here. The gallbladder appears to be normal with no wall thickening, pericholecystic fluid or stones. There are no peripancreatic, perigastric or celiac axis lymph nodes that can be visualized. The visualized portion of the liver appear to normal. There are no focal lesion or abnormalities. I'm beginning withdrawal of the scope and I'm revaluating all the structures on my way back. During withdrawal, there are no other abnormalities other than the ones that I've previously mentioned. There's no evidence of bleeding. The scope is out. The patient appears to be stable and there seem to be no immediate complications. The estimated blood loss is minimal. And this is the end of the procedure."
cyst05_vocals," This is Dr. Venkatakshan Thala dictating the procedure for an operandoscopic ultrasound with fine needle aspiration and esophago-gaso-diagnoscopy with biopsy. performed on a male patient test 3 whose date of birth is the 20th of August 1981 and MRN is 3446548 the procedure is being conducted on the 17th of January 2025 at the Johns Hopkins Baby Medical Center. We're with a patient who's a 56-year-old male presenting for the evaluation of pancreatic cysts. We're using an Olympus GF-UCT180 ultrasound and an Olympus GIF-HQ190 gastroscope. I'm now commencing the procedure, and I'm now introducing the gastroscope through the mouth than advancing it under direct visualization. As I pass a scope through the esophagus, I can observe LA grade B esophagitis with mucosal breaks involving more than one mucosal fold, but not circumferentially. I can't see any nodularity or strictures or masses so far. And I'm now advancing the scope into the stomach. The gastric mucus appears normal here with no ulcers, erosions or mass lesions. I'm now in the duodenum and I'm continuing to advance it into the first and second portions of the duodenum where I can see that the mucus appears normal. I can't see any erythema or alterations or any villus blocking. We're turning the gastroscope and I'm now introducing the echo endoscope. I can't see any changes in the mucus of the esophagus from the prior evaluation. the only abnormality that I can note here is the allegra B esophagitis. I'm advancing the scope into the stomach and I'm now in the second portion of the duodenum. I'm visualizing the pancreas. I can trace it to the tail beginning at the head. I can identify any pancreatic masses. The pancreatic pancrema shows a few echogenic foci and stranding but is otherwise unremarkable. The main pancreatic duct is not dilated. The MPD measures about three millimeters in the neck of the pancreas. The duct wall. I can see it's not echogenic. I can't see any dilated side branches or parenchyma calcifications either. There seem to be no abnormalities in the outer border of the gland. Of the duct, sorry. I can see multiple pancreatic cysts. I can count And one cyst in each of the head, body and tail. These multiple pancreatic cysts that I can identify are consistent with multifocal branch ductipiamine. The pancreatic head cyst measures about 9 millimeters. The cyst of the pancreatic body measures about 9 millimeters as well. And the pancreatic tail cyst measures about 5 millimeters. I can also see a elongated cluster of cysts that measures about 25 millimeters in the pancreatic head with ductal communication. I can't see any solid nodules or concerning features, I cannot identify any of those, but I'm performing a FNA using a 22 gauge needle, making a single pass into the largest cyst in the head of the pancreas, and I'm aspirating the fluid. The fluid appears to be clear. I'm aspirating this for DNA molecular marker analysis. Now I'm trying to visualize a bilirubin tree. I can trace the bile duct from the hilum to the ampulla and it appears to be normal in caliber with a thin duct wall with no stone strictures or dilations. The gallbladder appears to be normal with no wall thickening stones or pericholecystic fluid. The left adrenal gland appears to be normal as well. I'm able to visualize portions of the aorta and the celiac axis and they appear to be normal. I can't see any aneurysms or any abnormal vascular structures. I'm able to visualize the liver. I'm able to visualize the left lobe and the visualized portions of the left lobe of the liver appear to be normal. There seem to be no suspicious findings of vocal lesions here. I'm visualizing the spleen and that appears to be normal as well. The visualized portions of the spleen appears to be normal. I'm now beginning withdrawal of the endoscope. I'm revaluating the structures that I previously visualized as well. On withdrawal, I'm able to visualize these structures, and I'm not able to... There are no new abnormalities or any missed abnormalities. There's no evidence of bleeding or any immediate complications. the scope is out, the patient appears to be stable. The estimate of blood loss is none. And this is the end of procedure."
cyst08_vocals," This is Dr. Venkatak Shintala, dictating the procedure for an upper endoscopic ultrasound performed on a female patient, test 8, with date of birth of 20th August 1981, and medical record number is 3446548. The procedure is being conducted on the 17th of January 2025 at the Johns Hopkins Bayview Medical Center. We're here with a 45-year-old female who's presenting for evaluation of an incidentally detected pancreatic cyst on imaging. She has no prior history of pancreatic disease, no family history of pancreatitis or pancreatic cancer. She has no prior history of weight loss, nausea, vomiting, fears, or chills. She's a non-smoker, consumes alcohol in moderation. A prior CD that was performed on the 3rd of November in 2024 showed a very small hypotense lesions in the pancreatic body with a normal pancreatic duct. The patient's undergoing EUS for further evaluation of a pancreatic cyst along with a colonoscopy for colon cancer screening. I'm introducing the pediatric colonoscope and advancing it through to the diadenome. As I pass the scope through the esophagus, the mucosa appears to be normal. there appears to be no strictures nor dilarity of erosions I am in the stomach now which appears to be normal there seem to be no ulcers, erosions or mast lesions as I continue advancing it into the first and second portion of the diadenum where the mucus appears to be normal without erythema, villus blunting or ulcerations I am now introducing the Olympus PCFH190DL endoscope and I am now in the the esophagus. The mucosa remains unchanged from prior evaluation. I'm advancing the scope into the stomach and I'm now pushing the scope in the second portion of the diatom to perform a systematic evaluation of the pancreas and the serotonin structures. I'm beginning the evaluation of the pancreas at the head and tracing it to the tail. The pancreatic parenchyma appears to be normal with no evidence of mass lesions, hyper-echoic focal strands or calcifications. The main pancreatic duct is not dilated and measures about 1.4 mm in the neck, 1.1 mm in the body and 1.1 mm in the tail. The duct is traced to the ampulla and shows a smooth taper with no evidence of echogenic duct wall thickening, mucin, mast lesions, strictures or stones. No dilator branch ducts can be visualized, though I can see three pancreatic cysts in the neck and the body. So the first pancreatic cyst in the neck measures about 3.7 millimeters. It's definitely single chambered. It's thin walled without septation, so mural nodules. No calcifications and has communication with the main pancreatic duct. The second cyst in the body, the pancreatic body cyst, sorry, the pancreatic body, the first pancreatic body cyst, and the second cyst in general, it measures about 3.3 millimeters, is well-defined, single-chambered, thin wall without septations of mural nodules. There's no obvious communication with the main pancreatic duct. The second pancreatic body cyst and the third cyst in general overall measures about 2.7 mm x 6.7 mm. It was well defined, has two chambers separated by a thin septation. The numeral nodules calcifications are a connection to the main pancreatic duct. I'm now visualizing the biliary tree. The common bile duct appears to be normal in caliber and measures about 4.2 mm. I can't see any stricture stones or abnormalities. The gallbladder appears to be normal, with no wall thickening stones or pericollis cystic fluid. I can't visualize any peripancreatic, perigastric, or coelac axis lymph nodes. The visualized portions of the liver appear to be normal, with no focal lesions or abnormalities. There seems to be no ascites or nautilar deposits that can be seen. The left adrenal gland appears to be normal. Now visualizing the mediastinum. No peri-esophageal subcarinal AP window periaeotic subaerotic lymph nodes or masses that can be visualized. I can't see any pleural effusion either. I'm now beginning withdrawal of the scope. I'm on my way back I'm revaluating all the previously visualized structures. On withdrawal I'm not able to find any other abnormalities other than the ones that have already been mentioned. There is no evidence of bleeding. The scope is out. There are no immediate complications. The patient appears to be stable. The estimated blood loss is minimal. And this is the end of procedure."
