file,pred_transcript
mass04_vocals," This is test 4. Today is January 17th, 2025. MR number 3446548 Upper endoscopy, ultrasound without fine needle aspiration EGD diagnostic with or without brushing or washing, color doppler A 65 year old female is here for upper endoscopy ultrasound for the evaluation of pancreatic mask. She has a significant history of scleroderma, pulmonary hypertension, she is on supplemental oxygen cirrhosis and GI dysmotility I am using Olympus GF UCT 180 US curdy linear ultrasound now starting the procedure I am introducing the linear endoscope through the mouth and advancing to the descending duodenum. The scope advanced to the second portion of the duodenum. Moving forward I see a hyper echoic rounded mass in the region of the spleen. The patient has a history of splenectomy. So the mass measures 34.9 mm in the largest dimension, likely representing a spanule. I see an ill-defined hypoechoecletion in the tail of the pancreas. It measures 6.5 mm and it is adjacent to the spanule. I am using color doppler and I see I cannot do an FNA as it is surrounded by blood vessels as seen by the color Doppler. There is no safe window for biopsy. Moving forward, I see the pancreatic parenchyma shows mild lobularity. I see fatty infiltration. I see evidence of echogenic foca and starting the main duct of the pancreas is not dilated the duct measures 3 millimeter the head 1.1 millimeter the body and it is less than one millimeter the tail of the pancreas I am tracing the duct back to the ampulla in D1 and D2. I see a smooth taper. There is no evidence of echogenic duct wall or any presence of mucin, mass, thickening, stricture or stones there is no dilated branch ducts I see the bile duct is normal the gallbladder is also normal I see a normal made pancreatic duct and two peripancreatic lymph nodes each measuring 14 millimeter and 12 millimeter I see their asset adjusted to the pancreatic head I see the liver is normal as I remove the scope I see the esophagus stomach and the end you're done are double scope is out they will immediate complication after the procedure this is end of procedure test 4"
mass07_vocals," This is test 7. Today is January 17th, 2025. We have a 66 year old female who has come here for upper endoscopic ultrasound for the evaluation of pancreatic mass. I am using the Olympus GFUCT I'm introducing the scope through the mouth and I'm advancing to the second portion of the duodenum. Now I see a hypoechoic mass lesion found in the body of the pancreas. It measures 2.52 cm x 1.92 cm. Performing a fine needle aspiration with a 22 gauss shock core needle. There was total of 3 passes. Sample sent to cytopathology. Bedside celerity evaluation is adequate. Now the main pancreatic duct is dilated. It measures 1.5 mm in the head and 6.3 mm in the body of the pancreas. Other structures are normal. Now I am withdrawing the scope. I see the esophagus, stomach and the duodenum are normal. Scope is out. They were no blood loss there were no immediate complication end of procedure test seven"
mass03_vocals," Today is the 17th of September 2024 and we're here with a 70 year old male patient who's here presenting for an evaluation of a pancreatic mass. He initially presented with epigastric and back pain. A CT in CT abdomen pelvis that was performed of December in December of last year showed an infiltrative pancreatic mass that measured about 55 millimeters by 42 millimeters in the pancreatic body encasing the splenic artery and abutting the proto confluence and major vessels. We're now beginning the procedure and I'm introducing the echo endoscopes to patient's mouth and advancing it under correct visualization. As I pass the scope through the esophagus, the mucus appears normal. There seems to be no evidence of strictures, erosions, or masses. I'm now at the stomach. The gastric mucus appears normal. There seems to be no abnormalities of any kind. I'm proceeding to advance the scope through the pylorus and into the first and second portions of the diatom. The mucosa here appears normal as well. I'm now beginning to visualize the pancreas. I can see a heterogeneous hyperechoic mass in the pancreatic body that's extending into the pancreatic neck. The mass is about 52 mm by 40 mm and is abetting the portal confluence in the celiac takeoff. I can see that upstream to the mass that the main pancreatic duct is dilated and it measures about 8 mm in diameter. The pancrema here upstream to the mass appears to be atrophic as well. We are commencing the biopsy. I am using a 22 gauge shark core fine needle. Okay, biopsy is complete. I performed three passes under ultrasound guidance and used color doppler as well. I have acquired adequate samples. Okay, now I'm able to see the bile duct. I'm visualizing the bile duct and it measures about 2.2 mm and 3.1 mm in caliper. Yeah, so the bile duct is within the pancreatic head and it measures 2.2 mm and the pancreatic head measures about 3.1 mm. There seems to be no abnormalities. The gallbladder appears to be normal as well. There seems to be no evidence of wall thickening stones or pericardial cystic fluid. I can see two peripancreatic lymph nodes adjacent to the pancreatic head. First one measures 14 mm and the second one is 12 mm. I'm visualizing the liver now and shows no suspicious lesions or abnormalities of any kind. I'm withdrawing the scope and on withdrawal the visualized portions appear to be normal in the stomach and they seem to be normal in the esophagus as well. Scope is out. So far there seems to be no evidence of bleeding or any immediate complications. This is the end of procedure."
cancer06_vocals," This is Dr. Venkatakshan Thala, dictating the procedure for an operand of copy doctor sound without fine needle aspiration performed on a female patient, test 6, whose date of birth is the 20th of August 1981 and medical record number is 3446548. The procedure is being conducted at the Johns Hopkins Bayview Medical Center in today's the second agenda to identify the patient's a 54 year old female who's undergoing pancreatic cancer surveillance as a BRCA2 mutation carrier she has no family history of pancreatic cancer and is participating in the ongoing cancer for cancer of the pancreas screening research study cap study so gonna begin beginning the procedure now we're using a Olympus GF UC T 180 echo endoscope today and I'm now introducing the endoscope through the mouth and advancing it under direct visualization a staph acescope through the esophagus the mucus appears normal with no evidence of erosion strictures or masses Advance the scope into the stomach. The gastric mucus appears normal. There are no ulcers, nodularity or any other abnormalities. As I continue advancing the scope into the first and second portion of the diurnum, the mucus appears normal here without any erythema, villus blunting or mast lesions. I'm now positioning the scope in the second portion of the duodenum to perform a evaluation of the pancreas and the surrounding structures. I'm visualizing the pancreas, beginning at the head and tracing it all the way to the tail. The pancrema appears to be homogeneous and normal. There seems to be a small amount of minimal fat infiltration, but there's no changes at a suggestive chronic pancreatitis. Coming to the main pancreatic duct, it seems normal. It's normal in caliber. There's no echogenic duct wall thickening. There's no strictures. I can't see any stones. I can't see any mural nodules either. It measures about 2.8 millimeters at the head, and when you measure it at the tail, it's about 1.7 millimeters. I can't see any masses or cysts in the pancreas. I'm not visualizing the liver and it appears to be normal. There seems to be no focal lesions or any other suspicious findings. There are no peripancreatic, celiac, axis or perigastric lymph nodes that can be visualized. See the gallbladder and there seems to be no gallbladder which is consistent with the history of prior cholecystectomy. There's no ascites or nodular peritoneal deposits. As part of the CAP study protocol, I'm now collecting diurnal secretions adjacent to the normal appearing 85. I'm now beginning withdrawal of the scope. I'm now revaluating the structures on my way back. There seems to be no evidence of bleeding. There are no other abnormalities as far as I can see. The scope is out. The patient appears stable. There seems to be no immediate complications whatsoever. This is the end of the procedure. Assumption of bed loss is almost nil. End of procedure."
cancer04_vocals," This is Dr. Venkat Akshathala dictating the procedure for an upper endoscopic ultrasound without a finital aspiration performed on a female patient. Test 5, whose date of birth is the 20th of August 1981 with MRN 3446548. Right, the procedure is being done at the Johns Hopkins Bayview Medical Center and today is the 2nd of January, 2025. The patient is a 60-year-old female who's undergoing pancreatic cancer surveillance due to a strong family history of pancreatic cancer. She is participating in the ongoing CAPS research study. I am using an Olympus GF-UCT180 echo endoscope today. We are now beginning the procedure and I am now introducing the scope through the mouth into the oesophagus. As I pass the scope through the esophagus, the mucosa appears to be normal and there seems to be no erosion, strictures, or masses. Now on the stomach, there seems to be a moderate amount of retained thick liquid with particular material that's seen. This is despite overnight fasting. The gastric mucosa otherwise appears to be normal and there seems to be no ulcers, naudilarities, visible lesions. I'm continuing to advance into the duodenum. I'm now on the first part, advancing to the second portion of the duodenum. The mucus appears normal here. There seems to be no erythema, villus, blunting or mashed lesions. I'm now visualizing the pancreas. I'm beginning at the head and tracing it to the tail. The pancreas exhibits a diffuse hyper-aquaic focal end trans but there seems to be no discrete masses. It's this that can vary quite a bit. There seems to be diffuse lobularity throughout the pancreas, but it doesn't really meet the criteria for chronic pancreatitis. The tail appears fatty with consistent focal fat infiltration. The main pancreatic duct is normal in caliber with no echogenic duct wall thickening. There's no stricture stones or mural nodules. I'm visualizing the biliary tree and the common bile duct appears to be normal. There's no dilation stones or wall thickening and measures about 4.5 millimeters and appears to be normal. The liver, I'm visualizing the liver and it appears to be normal as well. There's no focal lesion or any suspicious findings. There's no peripancreatic, perigastric or celiac axis lymph nodes that can be visualized. As part of the CAHPS study protocol, I'm after collecting diurnal secretions adjacent to the normal appearing major papilla. That is the end and I'm now withdrawing the scope and re-polluting the structures on my way back. They appear to be normal. This is why even if there is bleeding or immediate complications, the scope is out. The patient appears to be stable. There seems to be very minimal blood loss. This is the end of the procedure."
cancer05_vocals," This is Dr. Venkatakshanthala, detailing the procedure for an upper endoscopic ultrasound without finital aspiration and an esophageal gastro-duodenoscopy with biopsy performed female patient test free who with the date of birth of August 20th 1981 and the medical record number is three four four six five four eight today is the second of January 2025 here at Johns Hopkins Bay Medical Center this is a a 50 year old female who's undergoing a high-risk pancreatic cancer surveillance due to a family history of pancreatic cancer. Her father had pancreatic cancer. Her last EUS was performed in 2021, I think in July, where a four millimeter pancreatic cyst was identified and and an MRI abdomen on 10th of July, 2024, showed a hyper-intense lesion in the pancreatic tail that measured about eight millimeters and an exophytic lesion from the pancreatic body that measured about nine millimeter, both of which have remained unchanged and do not enhance. No variant of the anatomy was noted. Additional findings included fatty infiltration the liver and the coli lithiasis. So we are now beginning the procedure. I'm using an Olympus GIF HQ 190 gastroscope today. So advancing the gastroscope to the mouth and advancing it under direct visualization. As I pass the scope through the esophagus, I can see that the mucous appears normal. It's approximately normal. The GE junction is about 40 centimeters from the incisors. In the distal esophagus, a LA-grade B esophagitis is present. is characterized with mucosal breaks that extends about two or more mucosal folds. No births, esophagus, no nodularity, no masses. I'm advancing the scope in the stomach. The mucos appears normal. I'm obtaining biopsy for good measures from the gastric body and the antrum to multifunctionally evaluate for H. pylori infection. As I advance the scope further into the first and second parts of the duodenum, I can see that the mucosa appears normal, there seems to be no evidence of any inflammation, nodularity or other abnormalities. I'm now withdrawing the gastroscope and I'm now introducing an echoendoscope. I'm using an Olympus GDF UCT180. I'm revaluating the mucosa and the esophagus, I'm just able to see a leg rib esophagitis distally. The stomach appears normal, the duodenum appears normal as well. And now I'm beginning to visualize the pancreas, beginning from the head and tracing to the tail. The parenchyma appears myelobular in the pancreatic body with some amount of stranding and myelofat infiltration. The main pancreatic duct is not dilated and can be traced from the head to the ampulla. It measures about 2.5 mm in the head, about 1.4 mm in the neck and about 1 mm in the body. It tapers smoothly without any wall thickening or strictures. There are no stones present or masses. There doesn't seem to be any dilated branch ducts either. I can't see any of those. I can identify two pancreatic lesions though. about a 5 millimeter well-defined single chambered anaquaic thin wall cysts in the body of the pancreas. No septations, no mural nodules, no calcifications of any kind. There's no obvious communication with the pancreatic duct either. Another pancreatic lesion is about 4.5 millimeters in diameter. It's heterogeneous, it's a hyper-echoic lesion and it's in the distal pancreatic body. It's concerning for a peripancreatic lymph node versus a pancreatic neuroendocrine tumor. Now I'm visualizing the bile duct, I can trace it, it appears normal there seems to be no dilation stones or abnormalities it's about 3.3 millimeters in caliber the gallbladder is normal in size and shape there's some amount of polylethiasis there's no wall thickening or pericole cystic fluid that's present a small 11.4 millimeter repair pancreatic lymph node can be identified there's no other lymphadenopathy of any kind I'm scanning the peritoneum now. Moving here. There's no ascites or nodular deposits. Visualizing the pancreas. It appears normal. There's no suspicious lesions or focal abnormalities. Seeing the adrenal gland now and that appears normal as well. It's part of the CAFS protocol. I'm collecting urinal secretions with the scope position close to the adjacent to the normal appearing major papilla. I'm now carefully withdrawing the scope, re-evaluating the structures on my way back. There seems to be no evidence of any abnormalities here, other than the ones that I previously spoke about. There's no evidence of bleeding either. The scope is out. There seems to be no immediate complications. This is the end of the procedure and yeah the blood loss appears to be minimal as well. It's the end of the procedure."
cancer07_vocals," This is Dr. Mekatak Shantala dictating the procedure for an upper endoscopic ultrasound without fine needle aspiration performed on a male patient, test 7, whose date of birth is August 20th, 1981. The medical record number is 3446548. The procedure is being conducted at the Johns Hopkins Bayview Medical Center and today is the 2nd of January 2025. The patient's a 70 year old male who's undergoing pancreatic cancer surveillance due to a BRCA1 mutation. He has a family history of pancreatic cancer and a previously identified pancreatic cyst. He's participating in the ongoing cancer of the pancreas creating research study, the CAMP study. I'm using a Olympus GIF HQ190 gastroscope today. I'm also using a Olympus GF UCT180AOS ultrasound as well. Now introducing the gastroscope through the mouth and advancing it under direct visualization into the esophagus. In the esophagus I can see fine white exudates in the mid and the proximal esophagus. Suggestive of candida infections. I'm obtaining biopsies for for good measure. Otherwise the mucosa appears normal and there were no strictures or masses or nodularities. As I advance the scope into the stomach I'm able to observe the mucosa is variegated and is kind of consistent with chronic gastritis. There are no ulcers or Redurations of masses. I'm biopsying the gastric antrum and body. I'm taking multiple biopsies here. I'm advancing the scope now into the duodenum. I'm in the first portion of the duodenum. I'm now entering the second portion of the duodenum. I'm able to see some myelar edema and edema in the duodenal bulb and in D2. I'm obtaining biopsies here as well. I'm now withdrawing the gastroscope and I'm now introducing the echo endoscope. Through the esophagus, now in the stomach, now in the duodenum, now trying to visualize the pancreas. I'm beginning at the head and tracing it all the way to the tail. I'm able to see a single anechoic oval cyst with a septated component in the body of the pancreas. It measures about 9.8 millimeters in maximum diameter. I'm not able to see any mural nodules within this. The cyst is communicating with the main pancreatic duct and is likely a branch duct IPMN. The main pancreatic duct on the other hand is mildly dilated in the neck. It's about 4 millimeters and in the proximal body measures about 3.4 millimeters. it's pretty stable from the prior EOS the doctors are normal in the head it's also normal in the mid body and the distal body as well and the tail there's no I can't see any visibly obstructing lesions here I can't see any pancreatic masses I can't identify any masses in the pancreas anyway moving to the biliary tree I'm able to see that the common bile duct is normal I can't see any stones or any other abnormalities. The CBD measures 4.1 millimeters. It's appearing pretty normal to me. I can't see any peripancreatic, perigastric or celiac axis lymph nodes. The ampulla appears normal. The gallbladder on the other hand seems to be some amount of micro OTSs or sludge that's present in the gallbladder. There's no perigallistic fluid though. There's no wall thickenings. secretion on the other hand I'm collecting it as part of the cap study protocol right so I'm now withdrawing the endoscope and on my way back I'm able to reevaluate the structures and they all seem there's nothing different from before. There's no evidence of bleeding. I'm withdrawing the scope. The scope is out. The patient appears to be stable. There seem to be no immediate complications whatsoever. This is the end of the procedure."
cancer01_vocals," Today is the 17th of September 2024 and this is Dr. Venkatakshan Thala dictating the procedure for an upper endoscopic ultrasound performed on a female patient whose date of birth is August 20th 1981 and medical record number is three four four six five four eight we're here with a 62 year old female who's undergoing an endoscopic ultrasound as part of her pancreatic screening in the context of her BRCA1 mutation the patient has no family history of pancreatic cancer adenoma sorry pancreatic adenocarcinoma though the her family history details are limited she is participating in the caps protocol uh with an mrcp that is pending uh we're now going to begin the procedure the patient is sedated and i'm now introducing an a corndoscope through the patient's mouth. The scope is being advanced under direct visualization. Advancing the scope through the esophagus, the mucosa appears normal with no evidence of any kind of strictures, erosions or masses. I'm now passing the scope into the stomach. The gastric mucosa appears to be normal. there appears to be no ulcers, erosions or abnormalities of any other kind. I'm advancing the scope through the pylorus and into the first portion of the duodenum. The mucus appears to be normal. I'm continuing to advance the scope into the second portion of the duodenum, positioning the endoscope adjacent to the ampulla for better imaging of the pancreas. I'm infusing water to provide a better interface for higher resolution imaging. I'm beginning to visualize the pancreas beginning at the head. I'm able to trace the pancreas from the head all the way to the tail. I'm visualizing this from the second portion of the duodenum. The parenchyma of the head shows nonspecific hyper-echoic focae and strands. The main pancreatic duct in the head measures about 2.2 millimeters and is not dilated. There appears to be no ductal thickening, mucin stones or masses or abnormalities of any other kind. I'm slightly retracting the scope to visualize the pancreatic neck. The pancreatic duct here measures about 1.4 millimeter and appears to be normal. As I continue withdrawing the scope, I'm assessing the pancreatic body. The duct here measures about 1.2 millimeters in this region and is normal. On further extraction of the scope I'm able to visualize the tail. The main panoptic duct here in the tail measures about 0.8 millimeters. The panoptic duct continues to show hyper-echoic foci and strands but there seem to be no concerning features like masses, frictions or stones. Overall the main panoptic duct tapered smoothly and no dilated branches branches branch ducts are identified. Since I'm here I'm visualizing the common bile duct which measures about 2.9 mm in diameter and also appears to be normal. There seems to be no wall abnormalities or stones or any other abnormal findings. As part of the CAPS protocol, I'm collecting secretions from the duodenum. I am retracting the scope to evaluate the gallbladder. It appears to be normal. There seems to be no wall thickening or stones or any pericholecystic fluid. There seems to be no peripancreatic lymphadenopathy either. Now I'm visualizing the liver. It appears to be normal with no focal lesions or any abnormalities. As I'm now withdrawing the scope, I'm revaluating the diurnum and the stomach, and the mucus appears to be normal. I'm in the esophagus now as I'm withdrawing the scope, and the mucus appears to be normal as well. There seems to be no evidence of inflammations or masses or ulcers of any kind. The scope is out. There seems to be no immediate complications of any kind. The estimated blood loss appears to be very minimal. This is the end of procedure."
