file,pred_transcript
cyst02_vocals," Today is the 17th of September 2024 and this is Dr Venkatakshanthala dictating the procedure for an upper endoscopic ultrasound with fine needle aspiration with color Doppler. On a male patient whose date of birth is August 20th 1981 with MR number 666666. This is a 69-year-old male patient presenting for an evaluation of a pancreatic cystic lesion. The patient has a significant past medical history of esophageal cancer, left breast cancer, and adrenal cortical adenoma and adrenal hyperplasia. A pancreatic protocol CT from December 30, 2023 revealed a 1.8-centimeter pancreatic body cyst with a questionable thin septation. The lesion has increased in size since 2019 and is suspected to be a side branch IPMN. We're now beginning the procedure. I'm introducing the gastroscope. It's an Olympus GIF HQ190 gastroscope. and introducing it through the mouth. I'm advancing it through the esophagus and through the stomach. I'm observing the lumen as I proceed. The esophageal mucosa appear to be normal. There seems to be no evidence of inflammation. There seems to be no strictures or masses. Being the stomach now, the gastric mucosa also appears to be unremarkable with no ulcers or erosions or masses of any kind. I'm now advancing into the duodenum. I'm in the second portion of the duodenum, and I'm beginning to evaluate the pancreas using a linear echoendoscope. The pancreatic parenchyma, I'm evaluating it beginning with the head. At the head of the pancreas, it appears to be mildly lobular with echogenic foci and strands consistent with chronic changes. The main pancreatic duct in the head measures about 1.3 millimeters and it's not dilated. I'm able to see a cyst in the head and the uncinate region that's about 7 millimeters in size appears to be single chambered. It has thin walls there's no septation there are also no mural nodules and there appear to be no calcifications there seems to be no evidence of communication between the cyst and the main pancreatic duct i'm retracting the scope slightly to well to value the pancreatic neck and body the largest cyst seems uh pretty large this seems to be in the distal body of the pancreas. It measures about 23.7 millimeter across 13.8 millimeter. It's a multi-luculated cyst with thin septations and thin walls. There are no mural nodules or calcifications in the cyst. I am confirming with Doppler imaging. and I can say that there are no intervening vascular structures. Using a 22-gauge fine needle, I'm performing a single pass under real-time ultrasound guidance to aspirate fluid from the cyst. I'm able to aspirate about 3 millimeters. I'm sending this fluid over for molecular marker analysis, CEA and glucose anomalies level analysis. as well. The cyst is not collapsing post-aspiration and about 8.3 mm residual portion remains. I'm further tracking the scope to evaluate the pancreatic tail. A single well-defined thin walled cyst can be seen here. It's about 3.0 mm. There are no mural nodules or septations calcifications of any kind. It doesn't seem to communicate with the main pancreatic duct. Talking of the main pancreatic duct, it can be traced from the head to the tail. It's about 1.3 millimeters in the head. It doesn't seem to be dilated. It measures about 2.5 millimeters in the neck and about 1.3 millimeters in the tail. There seems to be no abnormalities of any kind in the pancreatic duct, I mean the main pancreatic duct. There are no strictures, stones or thickening that can be identified. Oh, I am now visualizing the biliary tree. The common bile duct appears to be normal with no evidence of dilation, stones or wall thickening. it appears to be 3 mm in diameter. I'm now withdrawing the endoscope. Under traction, the diodenum appears to be normal. I'm re-evaluating the stomach as well. The gastric mucosa appears to be normal and so does the esophagus. There were no abnormalities of any kind noted in the visualized portions of the upper GI tract. I'm now withdrawing the scope. The scope is out. There appear to be no immediate complications and the blood loss appears to be very minimal. This is the end of procedure."
cyst07_vocals," This is Dr. Venkat Akshantala, detecting a procedure for an upper endoscopic ultrasound with fine needle aspiration performed on a male patient. Test 07 with a date of birth of August 20th, 1981, and medical record number 3446548. The procedure is being conducted at the Johns Hopkins Bayview Medical Center on the 17th of January, 2025. The patient's a 84-year-old male who's presenting for an evaluation of a pancreatic cyst. We're using the A110101 endoscope. I'm now commencing the procedure. I'm introducing the endoscope through the mouth and advancing a direct visualization. I'm passing the scope through the esophagus. the mucosa appears normal here with no strictures, nodularity or erosions. I'm advancing the scope into the stomach. The gastric mucosa appears normal with no ulcers, erosions or mast lesions here. I'm continuing to advance the scope into the first and second portions of the diodenum. And I can see that the mucosa appears normal here. There's or erythema, villus, blunting, or alterations. I'm withdrawing the gastroscope and introducing the endoscope into the patient's mouth. I'm now into the esophagus. The mucosa remains unchanged from prior evaluation. I'm advancing to the stomach, and I'm now pushing the endoscope in the second portion of the duodenum. And I'm beginning systematic evaluation of the pancreas and the surrounding structures. I'm visualizing the pancreas now, beginning at the head and tracing to the tail. I can see a single labulated anechoic cyst that's measuring greater than 33 millimeters cross 31 millimeters and can be identified at the head of the pancreas with septated components. There's a single 9x9mm mural nodule within the cyst wall and a mucin is present in the other compartments. I'm using a needle-based confocal laser endomicroscopy, the NCLE, using an AQ flex probe via a 19 gauge needle and that reveals a dark that reveals dark papillary projections. I'm also using the 19 gauge needle to perform the final aspiration using a 10cc syringe. I made a total of three passes. The main pancreatic duct is abnormal and measures about 5 mm in the head. Now visualizing the biliary tree, the common bile duct appears to be normal, measuring about 3 mm in diameter. I can't identify any intraluminal caliculi or biliary strictures. The ampulla appears normal on evaluation. I'm visualizing the liver and the visualized portions of the liver appear to be normal. I can't see any abnormalities or focal issues of any kind. I can't see any peripancreatic or perigastric or celiac axis lymph nodes. The visualized portion of the spleen that I'm now looking at appears to be normal. And I'm now beginning with a roll of the scope. I'm also re-evaluating the structures on my way back. there seems to be no evidence of bleeding the scope is out there appears to be no immediate complications the patient appears to be stable estimated blood loss is minimal and this is the end of the video"
cyst03_vocals," This is Dr. Venkat Akshanthala dictating the procedure for an upper endoscopic ultrasound with fine needle aspiration and EGD, esophageal gastrodiagnoscopy with biopsy performed on a female patient, test for whose date of birth is the 20th of August 1981 and medical record number is 3446548. The procedure is being conducted at the Johns Hopkins Bayview Medical Center and today is the 17th of January 2025. The patient's a 62-year-old female who's presenting for evaluation of GERD and an incidentally discovered pancreatic head cyst on previous imaging. We're using the EG29I10 and EG34J10U endoscopes. We're now commencing the procedure. And I'm now introducing the high-def endoscope through the mouth and advancing it under direct visualization. As I pass the scope through the esophagus, I can observe a LA grade C esophagitis with mucosal breaks involving more than 75% of the circumference. But I can't see any deep alterations. It's involving 75% of the circumference, but without deep alterations. There's also a 2-centimeter hiatal hernia. It could be classified as a hill grade 3. There's no proximal inlet patch that I can see. The esophageal mucus otherwise appears to be normal with no nodularity, strictures, or masses. I'm biopsying the mid and the proximal esophagus to rule out eosinophilic esophageitis. The gastroesophageal junction is noted at 33 centimeters from the incisors, with a diaphragm pinch noted at 35 centimeters. I'm now advancing the scope into the stomach. The gastric mucosa appears to be normal with no ulcers, erosions, or mast lesions. I'm taking random biopsies here to rule out helicobacter pylori infections. I'm now continuing to advance the scope into the first and second portions of the duodenum, where the mucus appears to be normal here without any erythema, ulcerations, or villous blunting. I'm now withdrawing the gastroscope and introducing the echo-endoscope to the patient's mouth. I'm now passing through the esophagus. The mucosa remains unchanged from prior evaluation. It's just the L.A. gritsy esophagitis that can be noted. The scope is advanced in the stomach, and I'm now pushing the endoscope in the second portion of the diadnum to visualize the pancreas, beginning at the head, and I'm trying to trace it to the tail. The pancreatic parenchyma appears to be homogeneous with mild diffuse fatty infiltration. A cystic complex can be seen in the head of the pancreas with a larger cystic component measuring 29.6 mm x 19.9 mm. The cyst has no mural nodules, no gasification and no obvious connection with the membrane periodic duct. I'm using a 22 gauge aspiration needle to perform FNA. I can confirm using color Doppler that no intervening vascular structures are present Before beginning the puncture, beginning the first pass, I'm able to obtain about 60 c of clear viscous fluid that I've aspirated. Oh, two grams of IV of cefetetan was administered prior to the puncture just for good measure for infection prophylaxis. The main pentatonic duct appears to be normal and measures about 3.0 millimeters in the head and 1.3 millimeters in the body and 0.6 millimeters in the tail. I'm now visualizing the biliary tree. I can see that the common bile duct is not dilated and it measures about 5.1 mm just below the hilum with no stone strictures or abnormalities. The gallbladder appears normal but I can see some microlithiasis without mural thickening or pericoldocystic fluid. No peripancreatic, periportal or coelac access lymph nodes can be visualized. I'm now visualizing the liver and the portions that I'm visualizing in the liver demonstrate a hepatic steatosis with mild blunting of the liver edge. There are no mass lesions or intrahepatic biliary ductal dilation. I can't see any ascites or nodular dipostas either. I'm beginning withdrawal of the scope and re-evaluating the visualized structures on withdrawal. Withdrawal is almost complete and there's no evidence of bleeding. Withdrawal is now complete. There's no immediate complications. The patient appears to be stable. The estimated blood loss is none. This is the end of procedure."
mass06_vocals," This is test 6. Today is January 1st, 2025. Medical record number XXX. We have a 49-year-old male for an upper endoscopic ultrasound for the evaluation of pancreatic uncinate mass. I am using the EG34J10U. I am introducing the scope through the mouth and I am advancing to the descending durendum. Now in the durendum as I am advancing I see a 3.7 x 2.8 cm hypoechoic round and well-defined in mass in the unsafe process of the pancreas there is peripheral vasculature the mass is not encasing any structures now I'm using 22 gauze acquire FNB needle I'm taking the biopsy of the bus I see the rest of the pancreatic parenchyma is hyper echoic suggestive of fatty infiltration The main pancreatic duct is non-dilated. It measures 1.7 mm in the head and 0.9 mm in the tail. I see the bile duct is non-dilated. Measures 3.3 mm. The gallbladder looks normal. I see no lymph nodes. The liver is normal. as I am withdrawing the scope I am seeing the duodenum stomach and the esophagus they appear normal the scope is out there were no bed blood loss there were no immediate complication end of procedure test six"
mass09_vocals," satiety in october the ct abnormal taken on november 14th shows a three centimeter poorly characterized cystic lesion in the pancreas mri taken on november 19th 2024 demonstrated a large multi-septated cystic lesions in the pancreatic tail concerning for pancreatic malignancy cd chest short scattered patchy ground glass and consolidative opacities concerning for pneumonia she has lost about 15 pounds and she has a family history notable for colon cancer in father and brother cd pancreas protocol demonstrated large multi-cystic lesions extending from this pancreatic tail measuring approximately 4.7 centimeter into 5.7 centimeter into 8.1 centimeter with pancreatic duct proximal to this area and not appear appearing dilated now I'm beginning the procedure I am using the Olympus GF uct 180 introducing the scope through the mouth and I am advancing to the stomach body moving towards the duodenum I see the pancreas and performing a focused exam of the pancreatic tail I see a multi cystic lesions with solid components encasing the complete pancreatic tail and extending into the pancreatic body. Solid component measures 37.2 mm x 38.2 mm with a normal caliber appearing pancreatic duct transversing through the solid component. On examination of the pancreatic tail, I see several cystic components both towards the pancreatic tail and the body. I'm doing a fine needle biopsy of the solid compound with a 22 gauss sharp core needle. I'm using color Doppler to confirm if there is no intervening vascular structures. Now a total of three passes were performed the cytotechnologist is present to assist the cellularity other surrounding structures are normal now i'm withdrawing the scope i see the duodenum stomach and the esophagus they appear to be normal scope out the blood loss is minimum there were no immediate complications End of procedure. Test done."
mass08_vocals," This is test 8. Today is 17th January 2025. I am performing an upper endoscopic ultrasound with fine needle aspiration. We have a 67 year old male who has come here for evaluation of pancreatic tail mass. He has locally advanced pancreatic adenocarcinoma for which he has undergone systemic chemotherapy. he is planned for radiotherapy chemotherapy and he has a mass 4.7 into 5 centimeter in the pancreatic tail now I am beginning the procedure I am using the Olympus GF uct 180 I am introducing the scope through the mouth now advancing through to the stomach now moving towards the duodenum I see a hypoechoic lesion in the tail of the pancreas it is consistent with the patients known adenocarcinoma the mass measures 4 centimeter in largest dimension I see a multiple large collaterals on the edges of the lesion and also penetrating the lesion ferrocell placement was performed using standard techniques by our 22 cause F&A needle as I am withdrawing I see the bile duct is normal, liver is normal I don't see any lymph nodes as I'm withdrawing the scope I see the duodenum stomach and the esophagus are normal scope is out there is minimal blood loss there were no immediate complication this is end of procedure test it"
mass02_vocals," This is Dr. Venkatak Shintala dictating the procedure for an operandoscopic ultrasound with fine needle biopsy and color doppler performed on a female patient whose date of birth is September 20th, 1985 and medical record number is 3446544. Today is the 17th of September, 2024 and we are beginning the procedure at the Johns Hopkins Bayview Medical Center. The patient is a 77-year-old female who is presenting for an evaluation of a gastric fundus mass. She initially proceeded with dysphagia and abdominal pain. A priori GD on October 14th, 2023, showed a short skewed ingot, which was dilated using a 54 French bougie. I believe there was a 2-3 cm subepithelial lesion with a central ulcer that was identified in the fundus. The lesion was firm on probing with biopsy forceps, but no biopsies were performed at that time. I'm now introducing the gastroscope through the patient's mouth and I'm advancing it under direct visualization. We're using an Olympus HK190 gastroscope today. entering the esophagus, I can see that the uterus is normal. advancing the scope into the stomach and I can see the previously described gastric subepithelial lesion. It's along the higher left curve and anterior wall. The lesion is approximately two centimeters. I'm performing bite-on-bite biopsies here. I'm advancing the scope further into the duodenum. The mucus appears normal without evidence of the mass, also other abnormalities. I'm withdrawing the gastroscope and I'm planning to produce the endoscope next withdrawal is not complete I'm now introducing the echo endoscope through the patient's mouth I'm revaluating the esophagus the mucus is normal I'm now making my way to the stomach. On endoscopic ultrasound, I can see that the lesion measures 27 mm by 14 mm. It appears heterogeneous and hypoechoic and is originating from the muscular sphincter. Within the lesion, there's a small 7 cm by 7 cm anechoic area. I am using a 22 gauge Charcore needle to perform a fine needle biopsy. I have so far made three passes into the lesion. I used color doppler before each pass. We are also using ROSE to confirm adequate cellular yield. On systematic evaluation of the surrounding structures, I can see the pancreas, it appears to be normal. There seems to be no abnormalities in the pancreas or dilation in the main pancreatic duct. I am able to visualize the common bile duct, it appears normal, it measures about 1.4 mm in diameter. There seems to be no evidence of stones, wall thickening or dilation. The diurnal mucosa is also normal on both endoscopic and ultrasound imaging. I'm beginning withdrawal of the endoscope. On withdrawal, I'm not able to see any evidence of bleeding or complications at the biopsy site. Withdrawal of the structures, the mucosa look normal, there seems to be no other abnormalities of any kind. Withdrawal is now complete. There seems to be no immediate complications, there is no blood loss of any kind. This is the end of procedure."
mass05_vocals," This is test 5. Today is January 17th, 2025. Medical record number XYZ. I will be doing upper endoscopic ultrasound with fine needle aspiration color doppler. We have 78 year old male for the evaluation of pancreatic head mass. I'll be using Olympus GF-UCT180. I'm beginning the procedure. I am introducing a linear echo endoscope into the mouth now it's advancing through the esophagus now the stomach now I am in the second portion of the diurnal I I did not examine the upper jet tract in detail. Now I see a ill-defined hypoechoic solid mass in the head of pancreas. It is 20.2 x 19.6 mm in largest diameter. The endosodographic views are suboptimal due to the shadow exerted by the indwelling self-expandable metal state in the carbon bile duct. I am doing fine needle biopsy of the mass. I am using 22 gauss shark core needle using the slow pull technique. Now I'm using color Doppler to confirm that there are no interwinding vascular structures. The biopsy specimen will be sent for on-site cytology evaluation and this confirms cellularity. Apart from the mass, the pancreatic pancrema appears normal with mild fatty infiltration but there is no lobularity, atrophy, calcification or irregular outer borders of the gland. I don't see any evidence of echogenic foci and stranding. The main pancreatic duct is not dilated and there is no evidence of echogenic duct wall, presence of mucin, mass or lesion or thickening or any store or strictures. The side branch is also not dilated. I see the bile duct has an indwelling metal biliary stent and the duct is completely collapsed over the stent. Now we see the gallbladder. The gallbladder is normal. roots I see two peripacriatic lymph nodes bashing 14 millimeter and 12 millimeter adjacent to the pancreatic head as I'm moving towards the liver I see the liver is normal the peritorium has mild ascites now I'm withdrawing the scope as a withdraw you see the deodorant now I'm seeing the stomach now the esophagus they all appear to be normal scope out estimated blood loss is very well all the specimens removed were said for biopsy there were no immediate application. End of procedure test 5."
mass10_vocals," This is test 10. Today is January 17th, 2025. Medical record number XYZ. I'll be performing upper endoscopic ultrasound with fine needle aspiration on a 54 year old male who is here for the evaluation of pancreatic head mass. He has the history of heavy alcohol use and negative ultrasound in 2019. And he also has loss of appetite since mid to end of October, which has progressed significantly with a 32 pound weight loss and pruritus. The previous CT scan shows a pancreatic head mass with dilated bile duct and abnormal liver enzymes. Now I am beginning the procedure. I am using the Olympus GFUCT 180. I am introducing the scope through this mouth and advancing to the second part of the duodenum. Now I see the pancreas. I see a 34.9 mm x 29.1 mm pancreatic head or the uncinate mass. It is poorly defined and heterogeneous. I see the main pancreatic duct transfers through the lesion and is dilated. It measures 4.3 mm. The common bile duct measures 5.3 mm. 5 needle aspiration of the sciatic compound is performed using a 22 gauss shark core needle. I am using color doppler to confirm that there is no intervining vascular structures. A total of 4 passes is performed. I see a peripancreatic lymph node enlarged measuring 13.2 mm. Now I am withdrawing the scope. I am seeing the neodymium, the stomach and the esophagus. They will appear normal. Scope out. There were minimal blood loss. There were no immediate complications. End of procedure. Test 10."
mass01_vocals," This is Dr. Venkatakshanthala detailing the procedure for an operandoscopic ultrasound with fine needle biopsy performed on a patient, testo 1, with a date of birth of August 20th 1981 and medical record number 3446548. The procedure is being conducted on 17th of September 2024 at the Johns Hopkins Bayview Medical Center. The patient is a 63-year-old female who is presenting for an EOS for the evaluation of pancreatic head mass and a dilated pancreatic duct. She has undergone two prior EOS procedures with FNA on August 16, 2023 and in November of 2023, well, November 13, 2023, performed by an outside provider, both of which resulted in a non-diagnostic cytology. We are using the EG38J10UT echo endoscope today. We are now commencing the procedure. I'm introducing the endoscope through the mouth and advancing under direct visualization. I'm now in the esophagus. As I pass the scope through the esophagus, I can see that the mucus here appears to be normal. There's no strictures, nodularity, or erosions that I can see. I'm advancing the scope into the stomach now. And it appears to be normal here with no ulcers, erosions, or mass lesions. Continuing to advance the scope into the first part of the diadenome. And now I'm in the second part of the diadenome. So far, the mucosa has appeared to be normal. There seems to be no erythema, with less blunting or alterations of any kind. I'm pushing the endoscope here, the second portion of the diurnum, to systematically evaluate the pancreas and the surrounding structures. I'm beginning to evaluate the pancreas at the head and tracing it to the tail. There's a partially circumscribed, yeah, so there's a 1.6 cm x 1.4 cm partially circumscribed isoechoic mass with papillary projections that can be seen at the ampulla and is obstructing the pancreatic duct. Upstream to the pancreatic duct dilation is noted and measures 9 to about 12 millimeters, tapering to 4.4 millimeters in the body. The duct is not visualized in the tail. There's a small 3.5 mm x 4.6 mm cyst communicating with the pancreatic duct that can be seen in the body. There's no concerning features. An additional intraductal filling defect can be observed in the pancreatic duct within the head, but I'm not biopsying this. But I am biopsying the ampullary mass using a 22 gauge short core needle. This is a fine needle biopsy. I did a prologue for passes. There's an on-site technologist who's confirmed adequate cellularity. The findings are suspicious for a main duct interductor papillary mucinous neoplasm, an IPMN. Visualizing the biliary tree, the common bile duct is of normal caliber, measuring between 4.1 millimeters and 4.6 millimeters. at the ampulla. There's no involvement of the bile duct by the intraductal pancreatic mass. I'm beginning withdrawal of the scope and I'm re-evaluating the visualized structures on withdrawal. On my way back, I can see that there are no other abnormalities other than the ones that I previously mentioned. There seems to be no evidence of bleeding. I'm now withdrawing the scope. The scope is out. The patient appears to be stable. There seems to be no immediate complications. The estimated blood loss is minimal and this is the end of procedure."
